{
  "$schema": "https://json-schema.org/draft/2020-12/schema",
  "type": "array",
  "items": {
    "type": "object",
    "required": [
      "job_id",
      "events",
      "status",
      "source",
      "observed_at"
    ],
    "properties": {
      "job_id": {
        "type": "string",
        "minLength": 1
      },
      "events": {
        "type": "array",
        "minItems": 1,
        "items": {
          "type": "object",
          "required": [
            "status",
            "source",
            "observed_at"
          ],
          "properties": {
            "status": {
              "enum": [
                "applied",
                "interviewing",
                "offer",
                "accepted",
                "rejected",
                "withdrawn",
                "closed"
              ]
            },
            "source": {
              "enum": [
                "inferred",
                "job_board",
                "employer_email",
                "employer_portal",
                "recruiter",
                "user_confirmed"
              ]
            },
            "observed_at": {
              "type": "string",
              "format": "date-time"
            }
          },
          "additionalProperties": false
        }
      },
      "status": {
        "enum": [
          "applied",
          "interviewing",
          "offer",
          "accepted",
          "rejected",
          "withdrawn",
          "closed"
        ]
      },
      "source": {
        "enum": [
          "inferred",
          "job_board",
          "employer_email",
          "employer_portal",
          "recruiter",
          "user_confirmed"
        ]
      },
      "observed_at": {
        "type": "string",
        "format": "date-time"
      }
    },
    "additionalProperties": false
  }
}
