[
  {
    "job_id": "8d52213a3a3e0871",
    "events": [
      {
        "status": "applied",
        "source": "user_confirmed",
        "observed_at": "2026-10-01T12:00:00+00:00"
      }
    ],
    "status": "applied",
    "source": "user_confirmed",
    "observed_at": "2026-10-01T12:00:00+00:00"
  }
]
